{
  "$schema": "https://schemas.ironicbuddha.dev/project-standards/v1/catalogue-release.schema.json",
  "schemaVersion": "1.0.0",
  "catalogueVersion": "1.0.0",
  "catalogueDigest": "sha256:2de6ec7ed2978c9308170566606d59869ad20f2893c6d92ada7884e1fe48efc8",
  "schemas": [
    "https://schemas.ironicbuddha.dev/project-standards/v1/catalogue-entry.schema.json",
    "https://schemas.ironicbuddha.dev/project-standards/v1/catalogue-release.schema.json",
    "https://schemas.ironicbuddha.dev/project-standards/v1/configuration.schema.json",
    "https://schemas.ironicbuddha.dev/project-standards/v1/detected-repository-state.schema.json",
    "https://schemas.ironicbuddha.dev/project-standards/v1/extension-registration.schema.json",
    "https://schemas.ironicbuddha.dev/project-standards/v1/fixture.schema.json",
    "https://schemas.ironicbuddha.dev/project-standards/v1/manifest.schema.json",
    "https://schemas.ironicbuddha.dev/project-standards/v1/migration.schema.json",
    "https://schemas.ironicbuddha.dev/project-standards/v1/rule-waiver.schema.json",
    "https://schemas.ironicbuddha.dev/project-standards/v1/source-guidance.schema.json",
    "https://schemas.ironicbuddha.dev/project-standards/v1/support-evidence.schema.json",
    "https://schemas.ironicbuddha.dev/project-standards/v1/verification-evidence.schema.json",
    "https://schemas.ironicbuddha.dev/project-standards/v1/verification-request.schema.json"
  ],
  "entries": [
    "entries/core.json",
    "entries/example-conflict.json",
    "entries/example-service.json",
    "entries/example-tests.json"
  ],
  "migrations": ["migrations/configuration-v1.json"],
  "fixtures": [
    "fixtures/invalid-capability-composition.json",
    "fixtures/invalid-exact-pin.json",
    "fixtures/valid-configuration.json",
    "fixtures/verification-invalid-binding.json",
    "fixtures/verification-no-op.json",
    "fixtures/verification-suppression-drift.json",
    "fixtures/verification-valid-suppression.json"
  ],
  "sourceGuidance": ["source-guidance/foundation.json"],
  "supportEvidence": ["support-evidence/foundation.json"],
  "extensions": ["extensions/foundation.json"]
}
